{
  "$schema": "https://raw.githubusercontent.com/wilanis/wilanis-js/main/packages/core/schemas/shape.schema.json",
  "label": "Preferences (answer)",
  "description": "The caller's preferences, from the session: the display name the directory gave and the theme chosen, when one was.",
  "layer": "edge",
  "fields": {
    "displayName": {
      "type": "string"
    },
    "theme": {
      "type": "string",
      "required": false
    }
  }
}
