{
  "$schema": "https://raw.githubusercontent.com/wilanis/wilanis-js/main/packages/core/schemas/shape.schema.json",
  "label": "Refresh outcome",
  "description": "Whether a refresh token was good, and the new pair when it was.",
  "layer": "core",
  "fields": {
    "refreshed": {
      "type": "boolean"
    },
    "tokens": {
      "type": "@access/domain/Tokens.shape.json",
      "required": false
    }
  }
}
