{
  "$schema": "https://raw.githubusercontent.com/wilanis/wilanis-js/main/packages/core/schemas/shape.schema.json",
  "label": "Credentials",
  "description": "A username and password, as a sign-in route receives them.",
  "layer": "edge",
  "fields": {
    "username": {
      "type": "string"
    },
    "password": {
      "type": "string",
      "secret": true
    }
  }
}
