{
  "$schema": "https://raw.githubusercontent.com/wilanis/wilanis-js/main/packages/core/schemas/shape.schema.json",
  "label": "Preferences update",
  "description": "A theme to keep in the session.",
  "layer": "edge",
  "fields": {
    "theme": {
      "type": "string",
      "enum": [
        "light",
        "dark"
      ]
    }
  }
}
