{
  "$schema": "https://raw.githubusercontent.com/wilanis/wilanis-js/main/packages/core/schemas/shape.schema.json",
  "label": "Principal gate",
  "description": "What a decision about a caller reads: the principal, absent for an anonymous caller.",
  "layer": "core",
  "fields": {
    "principal": {
      "type": "@access/domain/Principal.shape.json",
      "required": false
    }
  }
}
