{
  "$schema": "https://raw.githubusercontent.com/wilanis/wilanis-js/main/packages/core/schemas/shape.schema.json",
  "label": "Issued code",
  "description": "A challenge's code and when it expires.",
  "layer": "core",
  "fields": {
    "id": {
      "type": "string"
    },
    "code": {
      "type": "string"
    },
    "expiresAt": {
      "type": "string"
    }
  }
}
