{
  "$schema": "https://raw.githubusercontent.com/wilanis/wilanis-js/main/packages/core/schemas/shape.schema.json",
  "label": "Update request",
  "layer": "edge",
  "description": "PUT /monitor/{id}: the id from the route, the new call from the body.",
  "fields": {
    "id": {
      "type": "string"
    },
    "url": {
      "type": "string"
    },
    "method": {
      "type": "string",
      "enum": [
        "GET",
        "POST",
        "PUT",
        "PATCH",
        "DELETE"
      ]
    }
  }
}
